{
  "schema_version": "1.0.0",
  "mode": "roadmap",
  "response_language": "ja",
  "problem_statement": {
    "problem_id": "pb_japan_tour",
    "title": "日本一周旅行計画",
    "statement": "ヒッチハイクや徒歩を除く手段で、日本全国を一周する旅行計画を立てたい。鉄道、バス、船、飛行機などを組み合わせて、47都道府県すべてを訪れる。",
    "background": "人生の目標として日本一周を目指している。身体的な制約はないが、効率的かつ経済的なルートを知りたい。",
    "desired_outcome": "47都道府県すべてを訪れることができる現実的な旅行計画"
  },
  "insights": [
    {
      "insight_id": "in_jr_pass",
      "statement": "JR全国パスを活用すると鉄道移動のコストを抑えられる",
      "source": "旅行経験者のアドバイス",
      "importance": "high"
    },
    {
      "insight_id": "in_season",
      "statement": "季節によって最適なルートが異なる（北海道は夏、沖縄は冬など）",
      "source": "旅行ガイド",
      "importance": "medium"
    },
    {
      "insight_id": "in_ferry",
      "statement": "フェリーを活用すると離島アクセスや長距離移動が効率的",
      "source": "フェリー会社HP",
      "importance": "medium"
    }
  ],
  "constraints": [
    {
      "constraint_id": "co_time",
      "category": "time",
      "statement": "期間は最大3ヶ月以内",
      "severity": "hard"
    },
    {
      "constraint_id": "co_budget",
      "category": "resource",
      "statement": "予算は100万円以内",
      "severity": "hard"
    },
    {
      "constraint_id": "co_transport",
      "category": "other",
      "statement": "ヒッチハイクと徒歩（長距離）は除外",
      "severity": "hard"
    },
    {
      "constraint_id": "co_health",
      "category": "team",
      "statement": "1人で旅行可能な体力がある",
      "severity": "soft"
    }
  ],
  "available_assets": [
    {
      "asset_id": "as_budget",
      "type": "other",
      "name": "旅行予算100万円",
      "description": "貯金として確保済み"
    },
    {
      "asset_id": "as_time",
      "type": "other",
      "name": "3ヶ月の休暇",
      "description": "職場から休暇取得済み"
    },
    {
      "asset_id": "as_experience",
      "type": "skill",
      "name": "国内旅行経験",
      "description": "関東・関西方面の旅行経験あり"
    }
  ],
  "priority_hint": "medium"
}